{
  "id": "catalog",
  "kind": "service",
  "traffic": 30.2,
  "errors": 0.031,
  "p95_ms": 1180,
  "saturation": 0.96,
  "alive": true,
  "sat_label": "pool",
  "status": "failing",
  "assessment": "origin",
  "trend": {
    "errors": "rising",
    "latency": "rising",
    "saturation": "rising"
  },
  "extras": {
    "pool_in_use": 12,
    "pool_max": 12,
    "pool_wait_total": 87
  },
  "revision": "v2",
  "checks": ["catalog_products_probe"],
  "logs_indexed": true
}
